{
  "canon_id": "gcb-canon-core",
  "version": "1.0.0",
  "last_updated_utc": "2026-02-14T00:00:00Z",
  "authority": {
    "institution": "SydTek University",
    "canonical_name": "Goldstonian Concordance Bible",
    "tiebreak_doctrine": "Mirror → Water → Fire"
  },
  "token": {
    "label": "GCB Community Support Token (documentation reference)",
    "contract_address": "E68E27Y72FHTJH1MycB6KjX5PQAyKPYsRGZjMEx9pump",
    "reference_url": "https://pump.fun/coin/E68E27Y72FHTJH1MycB6KjX5PQAyKPYsRGZjMEx9pump",
    "non_investment_notice": "For provenance and participation documentation only."
  },
  "canonical_documents": [
    {
      "id": "versioning",
      "title": "Canon Versioning",
      "path": "canon/VERSION.md",
      "type": "markdown",
      "status": "canonical"
    },
    {
      "id": "doctrine",
      "title": "GCB Doctrine",
      "path": "canon/DOCTRINE.md",
      "type": "markdown",
      "status": "canonical"
    },
    {
      "id": "interpretive_rules",
      "title": "Interpretive Rules",
      "path": "canon/INTERPRETIVE_RULES.md",
      "type": "markdown",
      "status": "canonical"
    },
    {
      "id": "glossary",
      "title": "GCB Glossary (Controlled Vocabulary)",
      "path": "canon/GLOSSARY.md",
      "type": "markdown",
      "status": "canonical"
    },
    {
      "id": "safety_guardrails",
      "title": "Safety Guardrails",
      "path": "canon/SAFETY_GUARDRAILS.md",
      "type": "markdown",
      "status": "canonical"
    },
    {
      "id": "deprecations",
      "title": "Deprecations",
      "path": "canon/DEPRECATIONS.md",
      "type": "markdown",
      "status": "canonical"
    }
  ],
  "schemas": [
    { "id": "canon_index_schema", "path": "schemas/canon-index.schema.json" },
    { "id": "canon_claim_schema", "path": "schemas/canon-claim.schema.json" },
    { "id": "canon_citation_schema", "path": "schemas/canon-citation.schema.json" },
    { "id": "canon_term_schema", "path": "schemas/canon-term.schema.json" },
    { "id": "canon_change_schema", "path": "schemas/canon-change.schema.json" }
  ],
  "agent_requirements": {
    "must_validate_outputs": true,
    "must_use_glossary_definitions": true,
    "must_include_citations_for_factual_claims": true,
    "must_include_canon_alignment": true,
    "must_preserve_provenance_on_fork": true
  },
  "change_control": {
    "required_files_to_retain_on_fork": [
      "NOTICE",
      "CITATION.cff",
      "INSTITUTIONAL_AFFILIATION_STATEMENT.md",
      "ONCHAIN_METADATA.md",
      "canon/CANON_INDEX.json"
    ],
    "canonical_change_process": "Use the gcb-contribution-dao proposal + attestation workflow. Canon-level changes require: proposal, review, attestation, version bump when applicable."
  }
}